{
  "schema_version": "argus.telemetry_query/v1",
  "signal": "logs",
  "resource_ids": ["host_01"],
  "time_range": {"from": "2026-08-15T00:00:00Z", "to": "2026-08-15T01:00:00Z"},
  "field_projection": ["timestamp", "severity", "body"],
  "budget": {"max_rows": 1000, "max_scan_bytes": 104857600, "timeout_ms": 5000}
}
